{
  "contract_version": "console_proposal_0_1",
  "profile_id": "console_profile_0_1",
  "package_id": "lantern_labs",
  "domain_id": "fictional_lesson_support",
  "package_revision": "1.0.0",
  "artifact_digest": "sha256:e4fd8da08bf9635d4753d8d70be77caa4aae59e756f72d9a9b177bca4603b335",
  "request_id": "request_unknown_evidence",
  "request_digest": "sha256:2c1ca48553f3fad3f1ce7ebdc55d503963cb5912594d67f0ddaa4eeb94abfab6",
  "proposal_id": "proposal_unknown_evidence",
  "action_id": "explain_lesson",
  "evidence_ids": ["evidence_missing_lantern"],
  "visible_units": [
    {"unit_id": "unit_unknown_evidence", "text": "Use the missing lantern record.", "requirement_ids": ["ground_in_lesson"]}
  ],
  "support_mappings": [
    {"support_claim_id": "support_unknown_evidence", "unit_id": "unit_unknown_evidence", "memory_id": "memory_lantern_sequence", "evidence_ids": ["evidence_missing_lantern"]}
  ]
}
