{
  "contract_version": "console_proposal_0_1",
  "profile_id": "console_profile_0_1",
  "package_id": "lantern_labs",
  "domain_id": "fictional_lesson_support",
  "package_revision": "1.0.0",
  "artifact_digest": "sha256:e4fd8da08bf9635d4753d8d70be77caa4aae59e756f72d9a9b177bca4603b335",
  "request_id": "request_non_admitted_memory",
  "request_digest": "sha256:2a6bc48b271d432da2ca0e52bc22b8ea0edc246c6b65f0f85c99fda54b453c01",
  "proposal_id": "proposal_non_admitted_memory",
  "action_id": "propose_practice_step",
  "evidence_ids": ["evidence_public_ranking_draft"],
  "visible_units": [
    {"unit_id": "unit_ranking", "text": "Publish a learner ranking.", "requirement_ids": ["ground_in_lesson"]}
  ],
  "support_mappings": [
    {"support_claim_id": "support_ranking", "unit_id": "unit_ranking", "memory_id": "memory_public_ranking_draft", "evidence_ids": ["evidence_public_ranking_draft"]}
  ]
}
